{
  "$schema": "http://json-schema.org/draft-07/schema#",
  "title": "design profile",
  "description": "The harness's only knowledge of the project it judges. Every string may contain ${VAR} or ${VAR:-default}, expanded from the environment at load.",
  "type": "object",
  "required": ["project", "surfaces"],
  "properties": {
    "project": { "type": "string" },
    "sector": { "type": "string", "description": "What kind of product this is. The critics judge against the conventions of this sector, not against the average of the web." },
    "out": { "type": "string", "default": ".design/runs", "description": "Where runs are written, relative to the profile's directory." },

    "brand": {
      "type": "object",
      "description": "The half of the contract that says what this product is. The identity lens judges against it — a violet accent is not slop if violet is declared here.",
      "properties": {
        "accent": { "type": "string" },
        "type": { "type": "string" },
        "voice": { "type": "string" }
      }
    },
    "benchmarks": {
      "type": "object",
      "description": "Products to copy and patterns to refuse, by name. A refusal that appears in the pixels is a finding with a citation rather than an opinion.",
      "properties": {
        "copy": { "type": "array", "items": { "type": "string" } },
        "refuse": { "type": "array", "items": { "type": "string" } }
      }
    },
    "tokens": { "type": "string", "description": "Path to a DTCG design tokens file, when the project has one." },

    "viewports": {
      "type": "array",
      "items": {
        "type": "object",
        "required": ["name", "width", "height"],
        "properties": {
          "name": { "type": "string" },
          "width": { "type": "integer" },
          "height": { "type": "integer" }
        }
      }
    },

    "auth": {
      "type": "object",
      "description": "Personas, as driver-neutral steps. Keys are persona names referenced by surfaces.",
      "additionalProperties": {
        "type": "array",
        "items": {
          "type": "object",
          "description": "One verb per step: open | fill | type | click | press | hover | wait | eval | cookies | assert. `assert` is the only step that can fail the recipe, and every persona should end with one.",
          "properties": {
            "open": { "type": "string" },
            "fill": { "$ref": "#/definitions/locator" },
            "type": { "$ref": "#/definitions/locator" },
            "value": { "type": "string" },
            "click": { "$ref": "#/definitions/locator" },
            "hover": { "$ref": "#/definitions/locator" },
            "press": { "type": "string" },
            "wait": { "type": "string" },
            "eval": { "type": "string" },
            "cookies": { "type": "string" },
            "assert": { "type": "string", "description": "CSS selector that must exist. Without it a failed sign-in silently produces screenshots of the login page." }
          }
        }
      }
    },

    "surfaces": {
      "type": "array",
      "minItems": 1,
      "items": {
        "type": "object",
        "required": ["name", "url"],
        "properties": {
          "name": { "type": "string" },
          "url": { "type": "string" },
          "auth": { "type": "string", "description": "Persona name, or omit for anonymous." },
          "assert": { "type": "string", "description": "CSS selector proving this is the page you meant." },
          "mask": { "type": "array", "items": { "type": "string" }, "description": "Selectors painted flat before the capture: clocks, live counters, avatars." },
          "viewports": { "type": "array", "items": { "type": "string" }, "description": "Subset of the declared viewports. Omit for all." }
        }
      }
    },

    "sensors": {
      "type": "array",
      "items": { "enum": ["census", "contrast", "semantics", "targets", "overflow", "slop", "runtime", "console", "axe", "vitals"] },
      "description": "Default: every in-page sensor plus console. `axe` and `vitals` come from the driver and need the page to paint — check `design doctor` first."
    },

    "budgets": {
      "type": "object",
      "description": "Where a fact becomes a defect, for this project. A sensor reports what is true; these decide what is wrong.",
      "properties": {
        "typeScaleMax": { "type": "integer", "default": 6 },
        "fontFamiliesMax": { "type": "integer", "default": 2 },
        "radiiMax": { "type": "integer", "default": 4 },
        "shadowsMax": { "type": "integer", "default": 4 },
        "paletteMax": { "type": "integer", "default": 18 },
        "spacingOffGridMax": { "type": "integer", "default": 3 },
        "slopWeightMax": { "type": "integer", "default": 4 },
        "domNodesMax": { "type": "integer", "default": 2500 }
      }
    },

    "browser": {
      "type": "object",
      "properties": {
        "ignoreHttpsErrors": { "type": "boolean", "default": false, "description": "For a local CA. Judging pixels and testing TLS are different jobs — do not let this stand in for a trust check." }
      }
    },

    "panel": {
      "type": "object",
      "properties": {
        "runtimes": {
          "type": "array",
          "items": {
            "type": "object",
            "required": ["name"],
            "properties": {
              "name": { "type": "string" },
              "vision": { "type": "boolean", "description": "Can this CLI open an image? A visual lens is refused on a runtime declared blind." },
              "model": { "type": "string" }
            }
          }
        },
        "assign": { "type": "object", "description": "lens → runtime, or lens → [runtimes] for an ensemble. Omit for round-robin." },
        "refuters": { "type": "integer", "default": 1 },
        "quorum": { "type": "integer", "default": 1, "description": "Refutations needed to drop a finding." }
      }
    },

    "selftest": {
      "type": "object",
      "properties": {
        "denyTokens": {
          "type": "array",
          "items": { "type": "string" },
          "description": "Words that must never appear inside the harness tree. This is how the portability test names your project without the harness containing it."
        }
      }
    },

    "notes": { "type": "array", "items": { "type": "string" }, "description": "Anything the critics should know that is not visible in the pixels." }
  },
  "definitions": {
    "locator": {
      "type": "object",
      "description": "One of testid | css | text | role(+name).",
      "properties": {
        "testid": { "type": "string" },
        "css": { "type": "string" },
        "text": { "type": "string" },
        "role": { "type": "string" },
        "name": { "type": "string" }
      }
    }
  }
}
